{
  "packageId": "PKG-AMZ-ADS-M1A",
  "schemaVersion": 1,
  "sources": [
    {
      "id": "SRC-AMZ-ADS-REPORT",
      "objectType": "SourceArtifact",
      "revision": 1,
      "status": "candidate",
      "createdAt": "2026-08-09T00:00:00Z",
      "sourceRefs": [],
      "title": "Amazon Ads synthetic portfolio report",
      "format": "xlsx",
      "language": "bilingual",
      "contentHash": "sha256:aaaaaaaaaaaaaaaaaaaaaaaaaaaaaaaaaaaaaaaaaaaaaaaaaaaaaaaaaaaaaaaa",
      "license": {
        "state": "synthetic",
        "redistribution": true,
        "note": "M1-A design fixture; no customer or platform export data."
      }
    },
    {
      "id": "SRCREV-AMZ-ADS-REPORT-V1",
      "objectType": "SourceRevision",
      "revision": 1,
      "status": "candidate",
      "createdAt": "2026-08-09T00:00:00Z",
      "sourceRefs": ["SRC-AMZ-ADS-REPORT"],
      "sourceArtifactId": "SRC-AMZ-ADS-REPORT",
      "asOf": "2026-08-01",
      "contentHash": "sha256:bbbbbbbbbbbbbbbbbbbbbbbbbbbbbbbbbbbbbbbbbbbbbbbbbbbbbbbbbbbbbbbb"
    },
    {
      "id": "ELEM-AMZ-ADS-REPORT-PORTFOLIO",
      "objectType": "StructuralElement",
      "revision": 1,
      "status": "candidate",
      "createdAt": "2026-08-09T00:00:00Z",
      "sourceRefs": ["SRCREV-AMZ-ADS-REPORT-V1"],
      "sourceRevisionId": "SRCREV-AMZ-ADS-REPORT-V1",
      "elementType": "cell-range",
      "locator": "sheet=Portfolio!A2:H9",
      "contentHash": "sha256:cccccccccccccccccccccccccccccccccccccccccccccccccccccccccccccccc",
      "text": "Synthetic 14-day spend, sales, clicks, orders and ACOS comparison."
    }
  ],
  "evidence": [
    {
      "id": "EVID-AMZ-ACOS-DELTA",
      "objectType": "EvidenceFragment",
      "revision": 1,
      "status": "candidate",
      "createdAt": "2026-08-09T00:00:00Z",
      "sourceRefs": ["ELEM-AMZ-ADS-REPORT-PORTFOLIO"],
      "summary": "Synthetic fixture shows ACOS rising from 28.4% to 36.9% across adjacent seven-day windows.",
      "locator": {
        "sourceRevisionId": "SRCREV-AMZ-ADS-REPORT-V1",
        "structuralElementId": "ELEM-AMZ-ADS-REPORT-PORTFOLIO",
        "locator": "sheet=Portfolio!G2:H9",
        "contentHash": "sha256:cccccccccccccccccccccccccccccccccccccccccccccccccccccccccccccccc"
      },
      "grade": "LO-S-synthetic"
    },
    {
      "id": "CLAIM-AMZ-ACOS-RISING",
      "objectType": "Claim",
      "revision": 1,
      "status": "candidate",
      "createdAt": "2026-08-09T00:00:00Z",
      "sourceRefs": ["EVID-AMZ-ACOS-DELTA"],
      "statement": "The synthetic portfolio ACOS is higher in the latest seven-day window.",
      "supportRefs": ["EVID-AMZ-ACOS-DELTA"],
      "contradictionRefs": [],
      "applicability": ["synthetic portfolio fixture", "two adjacent seven-day windows"],
      "claimStatus": "supported"
    }
  ],
  "knowledgeObjects": [
    {
      "id": "CONCEPT-AMZ-ACOS",
      "objectType": "Concept",
      "revision": 1,
      "status": "candidate",
      "createdAt": "2026-08-09T00:00:00Z",
      "sourceRefs": ["CLAIM-AMZ-ACOS-RISING"],
      "canonicalTerm": "Advertising Cost of Sales",
      "aliases": ["ACOS", "广告投入产出比"],
      "definition": "Ad spend divided by attributed sales for the same attribution and reporting window.",
      "examples": ["28.4% in the earlier synthetic seven-day window"]
    },
    {
      "id": "METRIC-AMZ-ACOS",
      "objectType": "Metric",
      "revision": 1,
      "status": "candidate",
      "createdAt": "2026-08-09T00:00:00Z",
      "sourceRefs": ["CLAIM-AMZ-ACOS-RISING"],
      "name": "ACOS",
      "formula": "ad_spend / attributed_sales * 100",
      "inputs": ["ad_spend", "attributed_sales"],
      "unit": "%",
      "window": "seven calendar days with identical attribution settings",
      "failureModes": ["sales equals zero", "mixed attribution windows", "currency mismatch"]
    },
    {
      "id": "DECISION-AMZ-ACOS-DIAGNOSIS",
      "objectType": "DecisionModel",
      "revision": 1,
      "status": "candidate",
      "createdAt": "2026-08-09T00:00:00Z",
      "sourceRefs": ["CLAIM-AMZ-ACOS-RISING"],
      "inputs": ["ACOS delta", "CPC delta", "CVR delta", "attribution window", "retail availability"],
      "branches": [
        { "when": "ACOS rises and CPC rises while CVR is stable", "then": "inspect bid and traffic-cost drivers" },
        { "when": "ACOS rises and CVR falls", "then": "inspect conversion and retail-readiness drivers" }
      ],
      "outputs": ["ranked hypotheses", "required checks", "manual action draft"],
      "unknownPolicy": "Do not rank a hypothesis that depends on an unavailable input as a verified fact.",
      "stopConditions": ["attribution windows differ", "required sales or spend input is absent"],
      "reviewState": "pending-domain-review"
    },
    {
      "id": "CASE-AMZ-ACOS-SYNTHETIC",
      "objectType": "Case",
      "revision": 1,
      "status": "candidate",
      "createdAt": "2026-08-09T00:00:00Z",
      "sourceRefs": ["EVID-AMZ-ACOS-DELTA"],
      "title": "Synthetic Amazon Ads ACOS increase",
      "context": "A fixed portfolio fixture compares two seven-day windows.",
      "facts": ["ACOS rises from 28.4% to 36.9% in the fixture"],
      "decisions": ["request CPC, CVR, attribution and retail-readiness checks before any optimization"],
      "outcome": "Design-only draft; no advertising action was executed.",
      "evidenceRefs": ["EVID-AMZ-ACOS-DELTA"],
      "limitations": ["synthetic values", "no account history", "no domain approval"],
      "dataClass": "synthetic"
    },
    {
      "id": "PLAYBOOK-AMZ-ACOS-CHECK",
      "objectType": "Playbook",
      "revision": 1,
      "status": "candidate",
      "createdAt": "2026-08-09T00:00:00Z",
      "sourceRefs": ["DECISION-AMZ-ACOS-DIAGNOSIS"],
      "title": "ACOS change evidence check",
      "prerequisites": ["same attribution window", "spend and attributed sales available"],
      "steps": ["calculate comparable ACOS", "compare CPC and CVR", "record unknown retail inputs"],
      "checks": ["units and windows match", "every fact cites evidence"],
      "rollback": ["discard draft if source revision changes", "return to unknown state when inputs are missing"],
      "approval": ["ROLE-AMAZON-ADS-DOMAIN", "ROLE-PRODUCT-CONTENT"]
    }
  ],
  "skills": [
    {
      "id": "SKILL-AMZ-ACOS-DRAFT",
      "objectType": "Skill",
      "revision": 1,
      "status": "candidate",
      "createdAt": "2026-08-09T00:00:00Z",
      "sourceRefs": ["PLAYBOOK-AMZ-ACOS-CHECK"],
      "name": "Draft ACOS diagnostic action package",
      "inputContract": { "schemaRef": "https://mkd.local/schemas/task-package.schema.json" },
      "outputContract": { "schemaRef": "https://mkd.local/schemas/action-package.schema.json" },
      "tools": [
        { "toolId": "TOOL-READ-SNAPSHOT", "mode": "read", "sideEffect": false },
        { "toolId": "TOOL-CALCULATE-METRIC", "mode": "calculate", "sideEffect": false },
        { "toolId": "TOOL-DRAFT-ACTION", "mode": "draft", "sideEffect": false }
      ],
      "steps": ["load required closure", "validate metric inputs", "rank supported hypotheses", "draft manual checks"],
      "eLevel": "E2",
      "stopConditions": ["required metric inputs are missing", "evidence is expired or contradictory"],
      "rollback": ["discard generated draft", "retain immutable replay receipt"],
      "tests": ["GOLDEN-AMZ-ACOS-POSITIVE", "GOLDEN-AMZ-ACOS-MISSING-INPUT"],
      "promotionDecisionRef": "PROMOTION-AMZ-ACOS-SKILL"
    }
  ],
  "tasks": [
    {
      "id": "TASK-AMZ-ACOS-DIAGNOSE",
      "objectType": "TaskPackage",
      "revision": 1,
      "status": "candidate",
      "createdAt": "2026-08-09T00:00:00Z",
      "sourceRefs": ["SKILL-AMZ-ACOS-DRAFT"],
      "name": "Diagnose synthetic ACOS increase",
      "taskContract": "Explain the supported change, separate unknowns, and produce a manual action draft with no external writes.",
      "requiredClosure": {
        "objectIds": ["CLAIM-AMZ-ACOS-RISING", "METRIC-AMZ-ACOS", "DECISION-AMZ-ACOS-DIAGNOSIS", "PLAYBOOK-AMZ-ACOS-CHECK"],
        "allowedRelations": ["supports", "requires", "uses_metric", "implements", "validated_by"],
        "maxDepth": 3,
        "maxObjects": 24
      },
      "skillRef": "SKILL-AMZ-ACOS-DRAFT",
      "outputSchemaRef": "https://mkd.local/schemas/action-package.schema.json",
      "evaluationRefs": ["EVAL-AMZ-ACOS-M1A"],
      "eLevel": "E2",
      "publicInput": {
        "freeText": false,
        "fileUpload": false,
        "urlInput": false,
        "allowedParameters": ["caseId", "comparisonWindow"]
      }
    }
  ],
  "governance": [
    {
      "id": "POLICY-MKD-SYNTHETIC-LABEL",
      "objectType": "Policy",
      "revision": 1,
      "status": "approved",
      "createdAt": "2026-08-09T00:00:00Z",
      "sourceRefs": [],
      "title": "Synthetic evidence labeling",
      "rules": ["Every synthetic value must remain labeled LO-S-synthetic", "Synthetic output cannot be customer evidence"],
      "enforcement": "blocking"
    },
    {
      "id": "PERMISSION-AMZ-ADS-E2",
      "objectType": "PermissionRule",
      "revision": 1,
      "status": "approved",
      "createdAt": "2026-08-09T00:00:00Z",
      "sourceRefs": [],
      "targetRefs": ["SKILL-AMZ-ACOS-DRAFT", "TASK-AMZ-ACOS-DIAGNOSE"],
      "maxELevel": "E2",
      "allowedToolModes": ["read", "calculate", "draft"],
      "externalWrite": false
    },
    {
      "id": "PROMOTION-AMZ-ACOS-SKILL",
      "objectType": "PromotionDecision",
      "revision": 1,
      "status": "candidate",
      "createdAt": "2026-08-09T00:00:00Z",
      "sourceRefs": ["CASE-AMZ-ACOS-SYNTHETIC"],
      "candidateRef": "CASE-AMZ-ACOS-SYNTHETIC",
      "targetType": "Skill",
      "decision": "pending",
      "reviewerRoleRefs": ["ROLE-AMAZON-ADS-DOMAIN", "ROLE-ENGINEERING-TEST"],
      "reasons": ["M1-A fixture only; domain and test review are not accepted"]
    },
    {
      "id": "OWNERSHIP-AMZ-ACOS-TASK",
      "objectType": "Ownership",
      "revision": 1,